<?xml version="1.0"?>
            <xs:schema xmlns:xs="http://www.w3.org/2001/XMLSchema">
                <xs:element name="cakeorder">
                    <xs:complexType>
                        <xs:sequence>
                            <xs:element name="order" minOccurs="1" maxOccurs="unbounded">
                                <xs:complexType>
                                    <xs:sequence>
                                        <xs:element name="name" type="xs:string"/>
                                        <xs:element name="price">
                                            <xs:simpleType>
                                                <xs:restriction base="xs:integer">
                                                    <xs:minInclusive value="100"></xs:minInclusive>
                                                    <xs:maxExclusive value="2000"></xs:maxExclusive>
                                                </xs:restriction>
                                            </xs:simpleType>
                                        </xs:element>
                                        <xs:element name="baker" type="xs:string"/>
                                        <xs:element name="status" type="xs:string"/>
                                    </xs:sequence>
                                </xs:complexType>
                            </xs:element>
                        </xs:sequence>
                    </xs:complexType>
                </xs:element>
            </xs:schema>
            